utest/moe_aiter_persistent_best_config.json
{
  "1":{
  "BLOCK_SIZE_M": 16,
  "BLOCK_SIZE_N1": 128,
  "BLOCK_SIZE_N2": 64,
  "BLOCK_SIZE_K1": 64,
  "BLOCK_SIZE_K2": 64,
  "num_warps": 4,
  "num_stages": 2,
  "matrix_instr_nonkdim": 16,
  "kpack": 2
},
  "1024":{
    "BLOCK_SIZE_M": 32,
    "BLOCK_SIZE_N1": 32,
    "BLOCK_SIZE_N2": 64,
    "BLOCK_SIZE_K1": 64,
    "BLOCK_SIZE_K2": 32,
    "num_warps": 4,
    "num_stages": 3,
    "matrix_instr_nonkdim": 16,
    "kpack": 1
  },
  "2048":{
    "BLOCK_SIZE_M": 64,
    "BLOCK_SIZE_N1": 128,
    "BLOCK_SIZE_N2": 32,
    "BLOCK_SIZE_K1": 64,
    "BLOCK_SIZE_K2": 64,
    "num_warps": 4,
    "num_stages": 2,
    "matrix_instr_nonkdim": 16,
    "kpack": 2
  },
  "4096":{
    "BLOCK_SIZE_M": 64,
    "BLOCK_SIZE_N1": 128,
    "BLOCK_SIZE_N2": 32,
    "BLOCK_SIZE_K1": 64,
    "BLOCK_SIZE_K2": 64,
    "num_warps": 4,
    "num_stages": 2,
    "matrix_instr_nonkdim": 16,
    "kpack": 2
  },
  "8192":{
    "BLOCK_SIZE_M": 64,
    "BLOCK_SIZE_N1": 32,
    "BLOCK_SIZE_N2": 16,
    "BLOCK_SIZE_K1": 64,
    "BLOCK_SIZE_K2": 64,
    "num_warps": 4,
    "num_stages": 3,
    "matrix_instr_nonkdim": 16,
    "kpack": 1
  }
}
